{
  "id": "events",
  "version": "20261011T1545",
  "generatedAt": "2026-10-11T15:45:03Z",
  "sourceUpdatedAt": "2026-10-11T15:44:51Z",
  "stale": false,
  "artifacts": [
    {
      "kind": "geojson",
      "url": "https://pub-666b3b31460b4674b7a6d091cd74fed7.r2.dev/events/20261011T1545/current.geojson",
      "bytes": 86486,
      "name": "current"
    }
  ],
  "attribution": {
    "name": "GDACS — Global Disaster Alert and Coordination System (EC JRC / UN OCHA)",
    "url": "https://www.gdacs.org",
    "license": "Free use with attribution (GDACS terms of use)"
  },
  "coverage": "global",
  "bbox": [
    -169.9,
    -42.3008,
    180.0,
    64.9068
  ],
  "failures": 0,
  "sample": false,
  "versions": [
    "20261011T1545",
    "20261011T0904",
    "20261011T0214",
    "20261010T2342",
    "20261010T2018",
    "20261010T1623",
    "20261010T1120",
    "20261010T0518",
    "20261009T2355",
    "20261009T1950",
    "20261009T1435",
    "20261009T0727",
    "20261009T0108",
    "20261008T2048",
    "20261008T1528",
    "20261008T0754",
    "20261008T0121",
    "20261007T2137",
    "20261007T1635",
    "20261007T0908",
    "20261007T0226",
    "20261006T2308",
    "20261006T1910",
    "20261006T1343",
    "20261006T0646",
    "20261006T0019",
    "20261005T1833",
    "20261005T0908",
    "20261005T0207",
    "20261004T2313",
    "20261004T2006",
    "20261004T1658",
    "20261004T1232",
    "20261004T0613",
    "20261004T0025",
    "20261003T2153",
    "20261003T1844",
    "20261003T1515",
    "20261003T1124",
    "20261003T0548",
    "20261003T0034",
    "20261002T2104",
    "20261002T1639",
    "20261002T1105",
    "20261002T0502",
    "20261001T2348",
    "20261001T1949",
    "20261001T1433",
    "20261001T0705",
    "20261001T0049",
    "20260930T2124",
    "20260930T1658",
    "20260930T1124",
    "20260930T0541",
    "20260930T0013",
    "20260929T2050",
    "20260929T1609",
    "20260929T0939",
    "20260929T0248",
    "20260928T2333",
    "20260928T1844",
    "20260928T1124",
    "20260928T0445",
    "20260927T2350",
    "20260927T2112",
    "20260927T1747",
    "20260927T1306",
    "20260927T0709",
    "20260927T0143",
    "20260926T2327",
    "20260926T2053",
    "20260926T1755",
    "20260926T1417",
    "20260926T0955",
    "20260926T0505",
    "20260926T0007",
    "20260925T2121",
    "20260925T1755",
    "20260925T1303",
    "20260925T0737",
    "20260925T0157",
    "20260924T2333",
    "20260924T2043",
    "20260924T1729",
    "20260924T1219",
    "20260924T0641",
    "20260924T0128",
    "20260923T2313",
    "20260923T2038",
    "20260923T1725",
    "20260923T1218",
    "20260923T0644",
    "20260923T0133",
    "20260922T2304",
    "20260922T2014",
    "20260922T1714",
    "20260922T1232",
    "20260922T0649",
    "20260922T0134",
    "20260921T2251",
    "20260921T1941",
    "20260921T1420",
    "20260921T0715",
    "20260921T0132",
    "20260920T2327",
    "20260920T2129",
    "20260920T1900",
    "20260920T1625",
    "20260920T1225",
    "20260920T0708",
    "20260920T0143",
    "20260919T2336",
    "20260919T2139",
    "20260919T1922",
    "20260919T1713",
    "20260919T1403",
    "20260919T1043",
    "20260919T0556",
    "20260919T0106",
    "20260918T2251",
    "20260918T2043",
    "20260918T1748",
    "20260918T1418",
    "20260918T0949",
    "20260918T0507",
    "20260918T0024",
    "20260917T2214",
    "20260917T1907",
    "20260917T1505",
    "20260917T1005",
    "20260917T0511",
    "20260917T0020",
    "20260916T2159",
    "20260916T1857",
    "20260916T1505",
    "20260916T1015",
    "20260916T0521",
    "20260916T0044",
    "20260915T2218",
    "20260915T1906",
    "20260915T1513",
    "20260915T1023",
    "20260915T0527",
    "20260915T0041",
    "20260914T2207",
    "20260914T1843",
    "20260914T1315",
    "20260914T0621",
    "20260914T0109",
    "20260913T2306",
    "20260913T2056",
    "20260913T1814",
    "20260913T1504",
    "20260913T1128",
    "20260913T0550",
    "20260913T0052",
    "20260912T2259",
    "20260912T2103",
    "20260912T1838",
    "20260912T1621",
    "20260912T1305",
    "20260912T0925",
    "20260912T0510",
    "20260912T0042",
    "20260911T2237",
    "20260911T2006",
    "20260911T1741",
    "20260911T1353",
    "20260911T0947",
    "20260911T0506",
    "20260911T0027",
    "20260910T2223",
    "20260910T1949",
    "20260910T1718",
    "20260910T1338",
    "20260910T0908",
    "20260910T0426",
    "20260909T2357",
    "20260909T2153",
    "20260909T1924",
    "20260909T1619",
    "20260909T1155",
    "20260909T0635",
    "20260909T0127",
    "20260908T2326",
    "20260908T2112",
    "20260908T1804",
    "20260908T1426",
    "20260908T1002",
    "20260908T0519",
    "20260908T0038",
    "20260907T2218",
    "20260907T1945",
    "20260907T1553",
    "20260907T1005",
    "20260907T0454",
    "20260907T0015",
    "20260906T2225",
    "20260906T2043",
    "20260906T1822",
    "20260906T1608",
    "20260906T1248",
    "20260906T0848",
    "20260906T0419",
    "20260905T2357",
    "20260905T2211",
    "20260905T2025",
    "20260905T1809",
    "20260905T1258",
    "20260905T0917",
    "20260905T0528",
    "20260905T0051",
    "20260904T2259",
    "20260904T2058",
    "20260904T1819",
    "20260904T1502",
    "20260904T1109",
    "20260904T0557",
    "20260904T0103",
    "20260903T2310",
    "20260903T2056",
    "20260903T1759",
    "20260903T1419",
    "20260903T0509",
    "20260903T0036",
    "20260903T0018",
    "20260902T1604"
  ],
  "notes": [
    "events.window30d"
  ]
}
