{
  "id": "rivers",
  "version": "20261025T0836",
  "generatedAt": "2026-10-25T08:36:17Z",
  "sourceUpdatedAt": "2026-10-25T00:00:00Z",
  "stale": false,
  "artifacts": [
    {
      "kind": "json",
      "url": "https://pub-666b3b31460b4674b7a6d091cd74fed7.r2.dev/rivers/20261025T0836/cells.json",
      "bytes": 184833,
      "name": "cells"
    },
    {
      "kind": "parquet",
      "url": "https://pub-666b3b31460b4674b7a6d091cd74fed7.r2.dev/discharge/20261025T0836/20261025.parquet",
      "bytes": 152815,
      "name": "discharge"
    },
    {
      "kind": "json",
      "url": "https://pub-666b3b31460b4674b7a6d091cd74fed7.r2.dev/discharge/20261025T0836/20261025.json",
      "bytes": 523798,
      "name": "discharge-json"
    },
    {
      "kind": "geojson",
      "url": "https://pub-666b3b31460b4674b7a6d091cd74fed7.r2.dev/rivers/20260903T1315/spine.geojson",
      "bytes": 874820,
      "name": "spine"
    },
    {
      "kind": "json",
      "url": "https://pub-666b3b31460b4674b7a6d091cd74fed7.r2.dev/rivers/20260903T1315/points.json",
      "bytes": 1116418,
      "name": "points"
    },
    {
      "kind": "pmtiles",
      "url": "https://pub-666b3b31460b4674b7a6d091cd74fed7.r2.dev/rivers/20260903T1143/rivers.pmtiles",
      "bytes": 333863880,
      "name": "network"
    }
  ],
  "attribution": {
    "name": "Open-Meteo Flood API (Copernicus GloFAS v4) · HydroRIVERS mean discharge",
    "url": "https://open-meteo.com/en/docs/flood-api",
    "license": "CC BY 4.0 (Open-Meteo) · GloFAS: Copernicus licence"
  },
  "coverage": "global",
  "failures": 0,
  "sample": false,
  "versions": [
    "20261025T0836",
    "20261024T0818",
    "20261023T0843",
    "20261022T0847",
    "20261021T0845",
    "20261020T0845",
    "20261019T0909",
    "20261018T0812",
    "20261017T0756",
    "20261016T0822",
    "20261015T0829",
    "20261014T0854",
    "20261013T1051",
    "20261012T1110",
    "20261011T1012",
    "20261010T1001",
    "20261009T1046",
    "20261008T1048",
    "20261007T1027",
    "20261006T1036",
    "20261005T1042",
    "20261004T0959",
    "20261003T0919",
    "20261002T0957",
    "20261001T1020",
    "20260930T0953",
    "20260929T1000",
    "20260928T1001",
    "20260927T0925",
    "20260926T0844",
    "20260925T0858",
    "20260924T0837",
    "20260923T0844",
    "20260922T0841",
    "20260921T0910",
    "20260920T0843",
    "20260919T0811",
    "20260918T0823",
    "20260917T0848",
    "20260916T0844",
    "20260915T0850",
    "20260914T0908",
    "20260913T0827",
    "20260912T0802",
    "20260911T0812",
    "20260910T0817",
    "20260909T0817",
    "20260908T0814",
    "20260907T1034",
    "20260907T0831",
    "20260906T0801",
    "20260905T0746",
    "20260904T0806",
    "20260903T1315",
    "20260903T1247",
    "20260903T1143",
    "20260903T0036",
    "20260902T1604"
  ],
  "notes": [
    "rivers.ratioSource"
  ]
}
