{
  "id": "glaciers",
  "version": "20261001T1226",
  "generatedAt": "2026-10-01T12:26:42Z",
  "sourceUpdatedAt": "2025-12-31T00:00:00Z",
  "stale": false,
  "artifacts": [
    {
      "kind": "json",
      "url": "https://pub-666b3b31460b4674b7a6d091cd74fed7.r2.dev/glaciers/20261001T1226/massbalance.json",
      "bytes": 20520,
      "name": "massbalance"
    },
    {
      "kind": "geojson",
      "url": "https://pub-666b3b31460b4674b7a6d091cd74fed7.r2.dev/glaciers/20261001T1226/glaciers.geojson",
      "bytes": 325118799,
      "name": "outlines"
    },
    {
      "kind": "pmtiles",
      "url": "https://pub-666b3b31460b4674b7a6d091cd74fed7.r2.dev/glaciers/20261001T1226/glaciers.pmtiles",
      "bytes": 144338581,
      "name": "tiles"
    }
  ],
  "attribution": {
    "name": "Randolph Glacier Inventory v7.0 (RGI Consortium 2023, GLIMS/NSIDC) · WGMS annual mass-change estimates (2026)",
    "url": "https://doi.org/10.5067/f6jmovy5navz",
    "license": "CC BY 4.0 (RGI 7.0) · WGMS open access with citation (doi:10.5904/wgms-amce-2026-02-10)"
  },
  "coverage": "global",
  "legend": {
    "unit": "m w.e./yr",
    "stops": [
      {
        "value": -2,
        "color": "#C8873A",
        "label": "−2"
      },
      {
        "value": -1,
        "color": "#CFE6F0",
        "label": "−1"
      },
      {
        "value": 0,
        "color": "#EAF4F8",
        "label": "0"
      }
    ]
  },
  "failures": 0,
  "sample": false,
  "versions": [
    "20261001T1226",
    "20260907T1141",
    "20260902T2154"
  ],
  "notes": []
}
