{
  "id": "drought",
  "version": "20261026T0932",
  "generatedAt": "2026-10-26T09:32:50Z",
  "sourceUpdatedAt": "2026-10-01T00:00:00Z",
  "stale": false,
  "artifacts": [
    {
      "kind": "png",
      "url": "https://pub-666b3b31460b4674b7a6d091cd74fed7.r2.dev/drought/20261026T0932/cdi.png",
      "bytes": 35550,
      "name": "cdi",
      "bbox": [
        -180.0,
        -85.05112878,
        180.0,
        85.05112878
      ]
    },
    {
      "kind": "raster-pmtiles",
      "url": "https://pub-666b3b31460b4674b7a6d091cd74fed7.r2.dev/drought/20261026T0932/cdi.pmtiles",
      "bytes": 1432844,
      "name": "cdi-tiles"
    }
  ],
  "attribution": {
    "name": "Copernicus Emergency Management Service — Global Drought Observatory (European Commission, JRC)",
    "url": "https://drought.emergency.copernicus.eu",
    "license": "Copernicus data: free, full and open access with attribution"
  },
  "coverage": "global",
  "legend": {
    "unit": "class",
    "stops": [
      {
        "value": 0,
        "color": "transparent",
        "label": "none"
      },
      {
        "value": 1,
        "color": "#D9A45B",
        "label": "watch"
      },
      {
        "value": 2,
        "color": "#C8873A",
        "label": "warning"
      },
      {
        "value": 3,
        "color": "#7A4A1C",
        "label": "alert"
      }
    ]
  },
  "failures": 0,
  "sample": false,
  "versions": [
    "20261026T0932",
    "20261025T0853",
    "20261024T0838",
    "20261023T0859",
    "20261022T0907",
    "20261021T0905",
    "20261020T0905",
    "20261019T0934",
    "20261018T0832",
    "20261017T0817",
    "20261016T0843",
    "20261015T0850",
    "20261014T0913",
    "20261013T1112",
    "20261012T1131",
    "20261011T1032",
    "20261010T1023",
    "20261009T1104",
    "20261008T1107",
    "20261007T1047",
    "20261006T1053",
    "20261005T1103",
    "20261004T1018",
    "20261003T0939",
    "20261002T1017",
    "20261001T1037",
    "20260930T1012",
    "20260929T1019",
    "20260928T1022",
    "20260927T0944",
    "20260926T0903",
    "20260925T0919",
    "20260924T0856",
    "20260923T0900",
    "20260922T0900",
    "20260921T0930",
    "20260920T0904",
    "20260919T0831",
    "20260918T0843",
    "20260917T0908",
    "20260916T0905",
    "20260915T0910",
    "20260914T0928",
    "20260913T0847",
    "20260912T0821",
    "20260911T0831",
    "20260910T0835",
    "20260909T0837",
    "20260908T0834",
    "20260907T1109",
    "20260907T0855",
    "20260906T0823",
    "20260905T0809",
    "20260904T0828",
    "20260903T1308",
    "20260902T1604"
  ],
  "notes": [
    "drought.noSpi"
  ]
}
