{
  "id": "reservoirs",
  "version": "20261026T1026",
  "generatedAt": "2026-10-26T10:26:15Z",
  "sourceUpdatedAt": "2026-09-01T00:00:00Z",
  "stale": false,
  "artifacts": [
    {
      "kind": "json",
      "url": "https://pub-666b3b31460b4674b7a6d091cd74fed7.r2.dev/reservoirs/20261026T1026/latest.json",
      "bytes": 984132,
      "name": "latest"
    }
  ],
  "attribution": {
    "name": "Global Water Watch (Deltares, World Resources Institute, WWF) · GRanD",
    "url": "https://www.globalwaterwatch.earth",
    "license": "CC BY 4.0"
  },
  "coverage": "global",
  "legend": {
    "unit": "%",
    "stops": [
      {
        "value": 0,
        "color": "#7A4A1C",
        "label": "0"
      },
      {
        "value": 40,
        "color": "#C8873A",
        "label": "40"
      },
      {
        "value": 70,
        "color": "#7FB8D6",
        "label": "70"
      },
      {
        "value": 100,
        "color": "#EAF4F8",
        "label": "100"
      }
    ]
  },
  "failures": 0,
  "sample": false,
  "versions": [
    "20261026T1026",
    "20261012T1312",
    "20260914T1101",
    "20260907T1300",
    "20260902T1604"
  ],
  "notes": [
    "reservoirs.proxy",
    "reservoirs.partialList"
  ]
}
